{
  "schema_id": "https://gsd.local/schemas/runtime-evidence/m016-s03-safe-operational-evidence-pack.v1.json",
  "schema_version": "v1",
  "pack_id": "m016-s03-safe-operational-evidence-pack-v1",
  "pack_kind": "safe-operational-evidence-pack",
  "milestone": "M016-txa3vu",
  "slice": "S03",
  "task": "T05",
  "generated": "2026-07-19T20:24:01.780Z",
  "pack_digest": "ce5312d28b79d903490791f20f918773faa0c5d911d84f38e26115aa5bf794a5",
  "sources": [
    {
      "source_ref": "runtime-evidence/M016-S03-live-probe-results.json",
      "kind": "live_probe_results",
      "pre_hash_sha256": "69f0e243978fd91cccd673189e9b6ed57ae525fa5614b7c56264b84b32471fc3",
      "post_hash_sha256": "69f0e243978fd91cccd673189e9b6ed57ae525fa5614b7c56264b84b32471fc3",
      "sanitised_sha256": "951618958ade1b19af7e96f6448a14217f78564e57b8596d290e98b666ffb3d2",
      "independence_group": "m016-s03-probe-live",
      "size_bytes": 42267,
      "claim_ids": [
        "m016-s03-live-div1-hco",
        "m016-s03-live-div2-master-planner",
        "m016-s03-live-div3-treasury",
        "m016-s03-live-div4-production",
        "m016-s03-live-div5-qualifications",
        "m016-s03-live-div6-external",
        "m016-s03-live-div7-mission-control",
        "m016-s03-live-paperclip-health",
        "m016-s03-live-hermes-environment",
        "m016-s03-live-secret-posture",
        "m016-s03-live-cost-snapshot",
        "m016-s03-live-isolation-invariant",
        "m016-s03-live-redaction-posture"
      ],
      "projection_keys": [
        "canonical_protocol",
        "executed_count",
        "fail_closed_count",
        "generated",
        "line_class",
        "milestone",
        "mutation_stopped",
        "not_proven_count",
        "protocol_digest",
        "record_count",
        "records",
        "schema_id",
        "schema_version",
        "session",
        "slice",
        "stop_reason",
        "task"
      ],
      "captured_at": "2026-07-19T14:56:43.290Z",
      "record_count": 16,
      "executed_count": 4,
      "not_proven_count": 12
    },
    {
      "source_ref": "runtime-evidence/M016-S03-scratch-drill-results.json",
      "kind": "scratch_drill_results",
      "pre_hash_sha256": "297100483b53b6aa61476d2e0b872b20b3f7ae2e4059ddf264cf4e27988eff0c",
      "post_hash_sha256": "297100483b53b6aa61476d2e0b872b20b3f7ae2e4059ddf264cf4e27988eff0c",
      "sanitised_sha256": "a5654b6216278c3ab38dd90fbac37652f2a0fdaa573d1d2335a9bf5bf3f33cc3",
      "independence_group": "m016-s03-probe-drill",
      "size_bytes": 9159,
      "claim_ids": [
        "m016-s03-drill-restore",
        "m016-s03-drill-budget-stop",
        "m016-s03-drill-failure"
      ],
      "projection_keys": [
        "canonical_protocol",
        "drill_ledger_summary",
        "executed_count",
        "fail_closed_count",
        "generated",
        "isolation_violation",
        "line_class",
        "milestone",
        "not_proven_count",
        "protocol_digest",
        "record_count",
        "records",
        "residue_detected",
        "schema_id",
        "schema_version",
        "session",
        "slice",
        "stop_reason",
        "task"
      ],
      "captured_at": "2026-07-19T12:00:00.000Z",
      "record_count": 3,
      "executed_count": 3,
      "not_proven_count": 0
    },
    {
      "source_ref": "runtime-evidence/M016-S03-isolation-invariant.json",
      "kind": "isolation_invariant",
      "pre_hash_sha256": "005e9dddf4261daaaf9b8eb38d5a3a28ab248ae1e5e4e0c6e33e1ecd59587e65",
      "post_hash_sha256": "005e9dddf4261daaaf9b8eb38d5a3a28ab248ae1e5e4e0c6e33e1ecd59587e65",
      "sanitised_sha256": "3cd20b1c9d8d249535b10c429f46ef1a2153738a112421c0c75d2582abcfa3b1",
      "independence_group": "m016-s03-probe-drill-isolation",
      "size_bytes": 548,
      "claim_ids": [
        "m016-s03-isolation-invariant"
      ],
      "projection_keys": [
        "bounded_drill_count",
        "drill_kinds",
        "generated",
        "isolation_violation",
        "ledger_total_entries",
        "milestone",
        "owned_marker_present",
        "residue_detected",
        "schema_id",
        "schema_version",
        "scratch_root",
        "slice",
        "stop_reason",
        "task"
      ],
      "captured_at": "2026-07-19T12:00:00.000Z"
    },
    {
      "source_ref": "runtime-evidence/M016-S03-live-probe-protocol.json",
      "kind": "live_probe_protocol",
      "pre_hash_sha256": "86d3e44775b70edfcaf8eb68ec160c58fd62fc2cd7f32119c3213a5d986ea990",
      "post_hash_sha256": "86d3e44775b70edfcaf8eb68ec160c58fd62fc2cd7f32119c3213a5d986ea990",
      "sanitised_sha256": "7b03ae4f4a69594da3f8730d27335159d9244b6191788bc6246d27b3f254ca09",
      "independence_group": "m016-s03-probe-live-protocol",
      "size_bytes": 1797,
      "claim_ids": [
        "m016-s03-live-protocol"
      ],
      "projection_keys": [
        "canonical_protocol",
        "executed_count",
        "fail_closed_count",
        "gates",
        "generated",
        "line_class",
        "milestone",
        "not_proven_count",
        "protocol_digest",
        "record_count",
        "replays_deterministic",
        "schema_id",
        "schema_version",
        "session",
        "slice",
        "task",
        "verdict"
      ],
      "captured_at": "2026-07-19T12:00:00.000Z"
    },
    {
      "source_ref": "runtime-evidence/M016-S03-scratch-drill-protocol.json",
      "kind": "scratch_drill_protocol",
      "pre_hash_sha256": "d3e9c8df410bebba199bc56fe34a9e63ba37547e7e465b0fbdcd2cec05d9d6b1",
      "post_hash_sha256": "d3e9c8df410bebba199bc56fe34a9e63ba37547e7e465b0fbdcd2cec05d9d6b1",
      "sanitised_sha256": "c6e238d3a01d622c6c977e67548f43a8e3622eaf431cdcb176f7cb149a76f397",
      "independence_group": "m016-s03-probe-drill-protocol",
      "size_bytes": 1448,
      "claim_ids": [
        "m016-s03-drill-protocol"
      ],
      "projection_keys": [
        "canonical_protocol",
        "executed_count",
        "fail_closed_count",
        "gates",
        "generated",
        "line_class",
        "milestone",
        "not_proven_count",
        "protocol_digest",
        "record_count",
        "replays_deterministic",
        "schema_id",
        "schema_version",
        "session",
        "slice",
        "task",
        "verdict"
      ],
      "captured_at": "2026-07-19T12:00:00.000Z"
    }
  ],
  "s02_baseline": {
    "source_ref": "runtime-evidence/M016-S02-bos-mission-proof.json",
    "pre_canonical_hash": "435037155fdf6e3c5394e55e972ae75fa03d45731bd349af0050ab8ea0b5c537",
    "post_canonical_hash": "435037155fdf6e3c5394e55e972ae75fa03d45731bd349af0050ab8ea0b5c537",
    "unchanged": true
  },
  "role_matrix": [
    {
      "role": "Div1.HCO",
      "role_class": "division",
      "classification": "NOT_PROVEN",
      "independence_group": "m016-s03-probe-div1-hco",
      "source_ref": "runtime-evidence/M016-S03-live-probe-results.json",
      "probe_id": "M16-S03-PROBE-div1-hco-no-target-400ce295",
      "methodology": "live-readonly"
    },
    {
      "role": "Div2.MasterPlanner",
      "role_class": "division",
      "classification": "NOT_PROVEN",
      "independence_group": "m016-s03-probe-div2-master-planner",
      "source_ref": "runtime-evidence/M016-S03-live-probe-results.json",
      "probe_id": "M16-S03-PROBE-div2-masterplanner-no-target-5deb9249",
      "methodology": "live-readonly"
    },
    {
      "role": "Div3.Treasury",
      "role_class": "division",
      "classification": "NOT_PROVEN",
      "independence_group": "m016-s03-probe-div3-treasury",
      "source_ref": "runtime-evidence/M016-S03-live-probe-results.json",
      "probe_id": "M16-S03-PROBE-div3-treasury-no-target-2bd09913",
      "methodology": "live-readonly"
    },
    {
      "role": "Div4.Production",
      "role_class": "division",
      "classification": "NOT_PROVEN",
      "independence_group": "m016-s03-probe-div4-production",
      "source_ref": "runtime-evidence/M016-S03-live-probe-results.json",
      "probe_id": "M16-S03-PROBE-div4-production-no-target-4516d67f",
      "methodology": "live-readonly"
    },
    {
      "role": "Div5.QualificationsLibraryLearning",
      "role_class": "division",
      "classification": "NOT_PROVEN",
      "independence_group": "m016-s03-probe-div5-qualifications",
      "source_ref": "runtime-evidence/M016-S03-live-probe-results.json",
      "probe_id": "M16-S03-PROBE-div5-qualificationslibrarylearning-no-target-7a0381eb",
      "methodology": "live-readonly"
    },
    {
      "role": "Div6.External",
      "role_class": "division",
      "classification": "NOT_PROVEN",
      "independence_group": "m016-s03-probe-div6-external",
      "source_ref": "runtime-evidence/M016-S03-live-probe-results.json",
      "probe_id": "M16-S03-PROBE-div6-external-no-target-4537f75b",
      "methodology": "live-readonly"
    },
    {
      "role": "Div7.MissionControl",
      "role_class": "division",
      "classification": "NOT_PROVEN",
      "independence_group": "m016-s03-probe-div7-mission-control",
      "source_ref": "runtime-evidence/M016-S03-live-probe-results.json",
      "probe_id": "M16-S03-PROBE-div7-missioncontrol-no-target-421b3417",
      "methodology": "live-readonly"
    },
    {
      "role": "paperclip_health",
      "role_class": "infrastructure",
      "classification": "NOT_PROVEN",
      "independence_group": "m016-s03-probe-paperclip-health",
      "source_ref": "runtime-evidence/M016-S03-live-probe-results.json",
      "probe_id": "M16-S03-PROBE-paperclip_health-no-target-962e3e75",
      "methodology": "live-readonly"
    },
    {
      "role": "hermes_environment",
      "role_class": "infrastructure",
      "classification": "NOT_PROVEN",
      "independence_group": "m016-s03-probe-hermes-environment",
      "source_ref": "runtime-evidence/M016-S03-live-probe-results.json",
      "probe_id": "M16-S03-PROBE-hermes_environment-no-target-b972fa5d",
      "methodology": "live-readonly"
    },
    {